status_id,status_message,link_name,status_type,status_link,status_published,num_reactions,num_comments,num_shares,num_likes,num_loves,num_wows,num_hahas,num_sads,num_angrys,num_special
5281959998_10151198425939999,Fly with scientists over a Texas-size chunk of floating ice. What they discover will help predict Antarctica’s fate.,A Shifting Continent,video,https://www.facebook.com/nytimes/videos/10151198425939999/,2017-06-10 07:25:00,1849,113,643,1396,42,179,11,210,5,6
5281959998_10151198307359999,"We're with the former New York City Ballet dancer Wendy Whelan, who retired in 2014 but has never stopped performing and working with choreographers on new dances. Leave your questions in the comments, and NYT reporter Josh Barone will ask some.",Watch Wendy Whelan Dance,video,https://www.facebook.com/nytimes/videos/10151198307359999/,2017-06-09 10:36:36,1020,155,116,794,201,17,5,1,1,1
5281959998_10151198237779999,"We're live in London, after Prime Minister Theresa May of Britain lost her overall majority in Parliament in a dramatic snap election. NYT journalist Stephen Farrell breaks down the results. Leave your questions for him in the comments.",Britain’s Conservatives lose majority in snap election,video,https://www.facebook.com/nytimes/videos/10151198237779999/,2017-06-09 09:44:19,505,280,93,411,46,23,12,1,11,1
5281959998_1871422109741969,The fight over President Trump’s travel ban on people from 6 Muslim-majority countries has reached the Supreme Court. But some experts say Trump’s tweets may undermine his chances of winning the case.,Trump’s Tweets vs. Travel Ban,video,https://www.facebook.com/nytimes/videos/1871422109741969/,2017-06-09 05:55:00,874,182,84,628,14,21,158,6,44,3
5281959998_1871346066416240,"The Baltimore Police Department recovers about 3,000 illegal guns from its streets each year. The weapons range from semiautomatics to German World War II firearms.",See the Guns Pulled Off Baltimore’s Streets,video,https://www.facebook.com/nytimes/videos/1871346066416240/,2017-06-08 15:10:00,359,80,64,232,11,88,2,17,9,0
5281959998_10151197030549999,"Ani DiFranco is here to perform some songs for us. Leave your questions in the comments, and NYT journalist Andrew R. Chow will ask her some.",Ani DiFranco Live Performance,video,https://www.facebook.com/nytimes/videos/10151197030549999/,2017-06-08 11:54:37,3070,884,888,1450,1578,12,10,1,12,7
5281959998_10151196996544999,"""We're talking about a foreign government that using technical intrusion and lots of other methods tried to shape the way we think, we vote and act. That is a big deal,"" testified James Comey. 

Read more: http://nyti.ms/2sHj8q1",James Comey Testimony: ‘They’re Coming after America’,video,https://www.facebook.com/nytimes/videos/10151196996544999/,2017-06-08 11:39:13,9571,355,1771,8392,563,475,33,29,77,2
5281959998_10151196869704999,"""I was honestly concerned that he might lie about the nature of our meeting and so I thought it really important to document it,"" testified former FBI director James Comey on Donald J. Trump. Read more: http://nyti.ms/2sHj8q1",James Comey Testimony: ‘I thought it really important to docum...,video,https://www.facebook.com/nytimes/videos/10151196869704999/,2017-06-08 10:14:25,10999,538,1156,9273,589,961,117,26,33,0
5281959998_10151196768729999,"James B. Comey, the former F.B.I. director, is testifying in front of the Senate Intelligence Committee. Mr. Comey, who was abruptly fired by President Donald J. Trump last month, is expected to discuss Mr. Trump’s attempts to end the bureau’s investigation into his former national security adviser’s contacts with Russia",Live: Comey Senate Intelligence Committee Testimony,video,https://www.facebook.com/nytimes/videos/10151196768729999/,2017-06-08 09:03:00,19151,11699,5494,13974,3156,950,426,125,518,2
5281959998_10151196285164999,"Join Academy Award-nominated actress and producer Salma Hayek Pinault, Golden Globe and Tony Award-winning actor John Lithgow, and director Miguel Arteta for a The New York Times - TimesTalks as they discuss their upcoming film, “Beatriz at Dinner."" Leave your questions for Salma, John, and Miguel in the comments, and we'll ask some after the talk.","TimesTalks: Salma Hayek, John Lithgow and Miguel Arteta",video,https://www.facebook.com/nytimes/videos/10151196285164999/,2017-06-07 18:24:11,1231,218,145,853,356,4,12,3,3,0
5281959998_10151196251939999,"Our reporter Matt Apuzzo explains what James Comey can expect to be asked when he testifies before the Senate Intelligence Committee.

Read more: http://nyti.ms/2shuZxE",What Questions Should Comey Expect?,video,https://www.facebook.com/nytimes/videos/10151196251939999/,2017-06-07 17:55:00,162,33,27,144,13,4,1,0,0,0
5281959998_10151195842134999,"Step inside designer Trina Turk's recently renovated midcentury home, in the hills of Echo Park in Los Angeles. Watch more #Daily360: http://nyti.ms/2nBwS5g",Inside a Renovated Midcentury Masterpiece,video,https://www.facebook.com/nytimes/videos/10151195842134999/,2017-06-07 15:40:01,272,20,40,235,25,11,0,0,1,0
5281959998_10151195825524999,"Meet the former Al Qaeda recruiter, turned FBI informant, who flagged one of the London attackers as a person to watch in 2015.",Meet the Former Extremist Who Flagged a London Attacker in 2015,video,https://www.facebook.com/nytimes/videos/10151195825524999/,2017-06-07 15:10:00,881,82,181,666,21,172,1,15,6,0
5281959998_10151195826164999,"ISIS is claiming responsibility for the deadly attacks in Iran, on the national Parliament and on the mausoleum of the Islamic Republic’s founder, Ayatollah Ruhollah Khomeini. At least 12 people were killed and 42 others were wounded. NYT Tehran bureau chief Thomas Erdbrink is in Los Angeles to explain the significance of this attack, and repercussions.",Deadly attacks in Iran,video,https://www.facebook.com/nytimes/videos/10151195826164999/,2017-06-07 11:48:08,762,255,164,330,20,29,5,307,71,0
5281959998_10151195732464999,Britain votes in parliamentary elections on June 8th. But an election that was expected to focus on last year's Brexit referendum has been overshadowed by three violent attacks in London and Manchester by Islamist extremists. The Times's Stephen Farrell and Stephen Castle talk about an election that went from being almost a foregone conclusion to one that is anything but.,British parliamentary elections,video,https://www.facebook.com/nytimes/videos/10151195732464999/,2017-06-07 10:13:03,308,135,61,267,20,5,4,4,8,0
5281959998_10151195308899999,"Our reporter Michael Schmidt on new revelations about James Comey confronting Jeff Sessions, saying he did not want to be left alone again with Donald J. Trump.

Read more: http://nyti.ms/2sQzTOJ",Comey Doesn't Want to Be Left Alone with Trump,video,https://www.facebook.com/nytimes/videos/10151195308899999/,2017-06-06 19:56:52,2403,173,616,1737,29,474,133,11,19,0
5281959998_10151195025209999,Hundreds came out to honor the victims of Saturday's terror attacks at London Bridge and Borough Market. Watch more #Daily360: http://nyti.ms/2ru0Jzt,Mourners Gather at London Bridge,video,https://www.facebook.com/nytimes/videos/10151195025209999/,2017-06-06 15:40:00,2115,87,121,1410,252,11,1,428,13,0
5281959998_1869975523219961,"""We left everything, it all burned."" In Central African Republic, an armed rebel group has burned villages to the ground, displacing thousands.

Watch more #Daily360: http://nyti.ms/2rNpWp7",Forced From Their Village by Violence,video,https://www.facebook.com/nytimes/videos/1869975523219961/,2017-06-05 14:40:00,275,6,31,113,2,2,0,116,42,0
5281959998_1869483959935784,At least 7 people were killed and dozens more were hospitalized in attacks in the center of London last night.,Terrorist Attacks at the Center of London,video,https://www.facebook.com/nytimes/videos/1869483959935784/,2017-06-04 08:25:00,1866,167,219,481,9,19,1,1095,261,0
5281959998_10151191660449999,"Police closed London Bridge on Saturday after a van mounted the sidewalk and mowed down pedestrians, resulting in multiple casualties. Soon after, there were reports of knife attacks at nearby Borough Market.",'Potential Terror Attack' in 2 London Locations,video,https://www.facebook.com/nytimes/videos/10151191660449999/,2017-06-03 20:40:13,2267,143,282,597,12,59,1,1236,362,0
5281959998_10151191549939999,"The Islamic State claimed responsibility for an attack on a casino in Manila. But authorities released security-camera footage that they say shows the assailant was a thief, not a terrorist. Read more: http://nyti.ms/2s5Sslk",Attack in Manila: Terrorism or Robbery?,video,https://www.facebook.com/nytimes/videos/10151191549939999/,2017-06-03 18:40:00,1200,176,266,753,12,145,19,212,59,0
5281959998_1869133583304155,"Pierre-Yves Cousteau, the youngest son of Jacques Cousteau, explores a sunken ship and artificial reef in the Bahamas. Join him aboard a submersible craft. Watch more #Daily360: http://nyti.ms/2ru0Jzt",Dive With a Cousteau in a Private Submarine,video,https://www.facebook.com/nytimes/videos/1869133583304155/,2017-06-03 11:55:00,815,50,133,696,73,45,1,0,0,0
5281959998_10151191214599999,"Join us at the March for Truth in Washington, where protesters are demanding an independent commission to investigate Russia's involvement with the 2016 election. Comment with your questions for those marching, and NYT journalist Nathalie Nieves will ask some.","March for Truth in Washington, DC",video,https://www.facebook.com/nytimes/videos/10151191214599999/,2017-06-03 10:31:33,3077,1155,383,2410,508,17,81,6,55,0
5281959998_10151191159039999,President Donald J. Trump is pulling the U.S. out of the Paris climate accord. We fact check his claims about what the agreement really does. Read more: http://nyti.ms/2rCZq0N,Fact Checking Donald Trump's Paris Climate Accord Claims,video,https://www.facebook.com/nytimes/videos/10151191159039999/,2017-06-03 09:55:00,22720,2074,18642,15715,283,262,404,1299,4756,1
5281959998_10151190315379999,"What does it take to run a research station on the least habitable continent, thousands of miles from civilization?",McMurdo Station,video,https://www.facebook.com/nytimes/videos/10151190315379999/,2017-06-03 07:55:00,572,38,140,496,37,38,1,0,0,0
5281959998_10151190811194999,"""There have been those that continue to deny that climate change is happening. Nobody can deny these images."" — Josh Haner, staff photographer, in a new ad for The New York Times.",Josh Haner | NYT commercial | The Truth Is Hard to Find,video,https://www.facebook.com/nytimes/videos/10151190811194999/,2017-06-02 21:35:00,6209,319,2021,3030,34,49,9,2609,478,0
5281959998_10151190373349999,"Stuart Skelton, who tackled the challenging lead tenor role in Richard Wagner's ""Tristan und Isolde"" last fall at the The Metropolitan Opera New York, is back to sing in Gustav Mahler's ""Das Lied von der Erde"" at Carnegie Hall. Leave your questions for him in the comments, and NYT reporter Josh Barone will ask some.",Live Performance: Stuart Skelton,video,https://www.facebook.com/nytimes/videos/10151190373349999/,2017-06-02 13:06:37,980,171,168,697,250,22,8,1,2,0
5281959998_1868691386681708,"How New York turns its food waste into compost and gas.

Read the full story: http://nyti.ms/2rjE5Zy
Watch more #Daily360: http://nyti.ms/2rNpWp7",How Garbage Becomes 'Black Gold',video,https://www.facebook.com/nytimes/videos/1868691386681708/,2017-06-02 11:40:32,572,34,95,518,40,14,0,0,0,0
5281959998_10151190279499999,Discover your implicit biases at the National Underground Railroad Freedom Center's new exhibit on bias. Exhibition manager Ryan Wynett and NYT reporter John Eligon are walking us through exercises that will reveal your bias.,Implicit Bias Exercises,video,https://www.facebook.com/nytimes/videos/10151190279499999/,2017-06-02 11:18:23,612,239,198,522,67,17,2,1,3,0
5281959998_10151190204194999,"Mick Mulvaney is one of President Donald J. Trump’s top economic advisers and is responsible for the administration's budget. Alan Rappeport, who covers economic policy for The Times, is talking with the budget director. Comment with your questions for Mr. Mulvaney, and Alan will ask some.",Discussing Trump Administration's Budget,video,https://www.facebook.com/nytimes/videos/10151190204194999/,2017-06-02 10:04:39,1491,1363,102,357,37,15,23,34,1025,0
5281959998_10151190137704999,"Hiring was up, according to the newly released U.S. jobs report for May. NYT reporter Patricia Cohen is here to break down the details. Leave your questions in the comments, and she'll answer some.",May Jobs Report,video,https://www.facebook.com/nytimes/videos/10151190137704999/,2017-06-02 09:05:29,329,154,48,290,24,4,2,4,5,0
5281959998_1868365343380979,Donald J. Trump announced on Thursday that the U.S. would pull out of the Paris climate accord. Here are some notable clips from his announcement.,Trump Pulls Out of Climate Accord as ‘Reassertion of America’s...,video,https://www.facebook.com/nytimes/videos/1868365343380979/,2017-06-01 21:25:00,9194,1385,595,1092,97,82,111,993,6819,0
5281959998_10151189430119999,"Samantha Bee and Jason Jones, the real-life couple and co-producers of Full Frontal with Samantha Bee, join us for a The New York Times - TimesTalks, where they'll dish on their professional and personal triumphs and mishaps, and what it’s like to be creative partners. Comment with your questions, and NYT reporter Dave Itzkoff will ask them some after the show",TimesTalks: Samantha Bee and Jason Jones,video,https://www.facebook.com/nytimes/videos/10151189430119999/,2017-06-01 18:09:16,1698,268,121,1159,458,6,55,6,14,0
5281959998_1868271863390327,"Donald J. Trump announced today that he will withdraw from the landmark global warming agreement. In this video, Brad Plumer, a climate reporter for The New York Times, explains the consequences.",U.S. to Leave Paris Climate Accord. What Happens Now?,video,https://www.facebook.com/nytimes/videos/1868271863390327/,2017-06-01 16:25:00,10851,987,4210,4403,95,98,61,2180,4014,0
5281959998_1868215320062648,"Thousands of Brazilians called for President Michel Temer to resign in Rio de Janeiro after recent revelations of his involvement in another corruption scandal. Watch more #Daily360: http://nyti.ms/2ru0Jzt

Correction: An earlier version of this video ​referred incorrectly to accusations against Ms. Rousseff​. ​ She was convicted on charges of manipulating the federal budget to conceal the country's economic problems​; she was not impeached on corruption charges.",A Copacabana Protest to Oust President Temer,video,https://www.facebook.com/nytimes/videos/1868215320062648/,2017-06-01 13:30:32,367,47,44,328,21,9,3,2,4,0
5281959998_10151189208289999,"Help us solve The New York Times Crossword. “Wordplay” columnist Deb Amlen is here with hints. Put your guesses in the comments, and please share this with your friends.",The Crossword,video,https://www.facebook.com/nytimes/videos/10151189208289999/,2017-06-01 12:05:22,336,838,55,296,31,5,2,1,1,0
5281959998_10151188530274999,"Should Confederate monuments be removed from public spaces? Let us know what you think in the comments, as we discuss the topic with Richard Marksbury of Tulane University, who is against the removal, and Michael Quess Moore, co-founder of Take ‘Em Down NOLA, who Is for the removal. NYT reporter John Eligon leads the conversation. Subscribe to the Race/Related newsletter here: http://nyti.ms/2eeczGO",RaceNYT: Should Confederate Monuments Stay or Go?,video,https://www.facebook.com/nytimes/videos/10151188530274999/,2017-05-31 20:02:59,896,1851,282,645,140,7,5,21,78,0
5281959998_10151188213989999,"What is it like to write a new opera? We're with the singer Daniela Mack and the creators of ""Elizabeth Cree,"" which has its premiere this fall. Leave your questions in the comments, and NYT reporter Josh Barone will ask some.",Live Performance: Opera in the Making,video,https://www.facebook.com/nytimes/videos/10151188213989999/,2017-05-31 14:45:53,699,166,126,534,146,13,3,3,0,0
5281959998_10151188085984999,"On Tuesday, Sean Spicer held his first White House press briefing since Donald J. Trump's international trip. We decode his statements.","Sean Spicer Press Briefing, Decoded",video,https://www.facebook.com/nytimes/videos/10151188085984999/,2017-05-31 13:37:45,1740,235,240,1062,26,47,433,28,144,0
5281959998_1867400726810774,"Conflicting messages, and Donald J. Trump himself, have made it difficult for the communications team to speak on his behalf. We explore the hardest job in politics.",The Hardest Job in Politics: Presidential Spokesman,video,https://www.facebook.com/nytimes/videos/1867400726810774/,2017-05-30 21:55:00,1459,183,205,967,13,40,312,21,106,0
5281959998_10151187112379999,"From The New York Times Opinion Section: ""The Shetland Pony Grand National is intrinsically British. It is a joyful example of everything that is great about our culture.""

Watch the full video: http://nyti.ms/2rlE5Zz",,video,https://www.facebook.com/nytimes/videos/10151187112379999/,2017-05-30 17:55:00,3554,903,1185,2922,458,56,84,6,28,0
5281959998_10151187086214999,"Join actress Amy Ryan and author Eddie Joyce for a conversation on ""Small Mercies,"" Mr. Joyce's new novel about a working-class Irish-Italian-American family battling their demons on Staten Island. Ms. Ryan is a friend of the author’s and frequently portrays the kinds of characters Mr. Joyce has created in “Small Mercies.” Comment with your questions, and NYT reporter Ginia Bellefante will ask some.","Big City Book Club with ""Small Mercies"" author Eddie Joyce",video,https://www.facebook.com/nytimes/videos/10151187086214999/,2017-05-30 16:51:29,343,103,41,289,49,1,2,0,2,0
5281959998_1867235820160598,"Manuel Noriega passed away today. Removing Noriega, the dictator of Panama, from power in 1989 not only entailed what was then the largest American military action since Vietnam, but also set the stage for future actions by the United States. Read more: http://nyti.ms/2shLGW9",Why Noriega’s Ouster Still Reverberates,video,https://www.facebook.com/nytimes/videos/1867235820160598/,2017-05-30 09:40:00,804,120,365,698,20,60,12,3,11,0
5281959998_1866352673582246,See what it's like to jump out of a plane in our #Daily360: http://nyti.ms/2ru0Jzt,The View From Above During an Air Show,video,https://www.facebook.com/nytimes/videos/1866352673582246/,2017-05-28 16:32:45,848,93,189,728,65,52,3,0,0,0
5281959998_1865872940296886,"Decades ago, José Fuster set out to transform a Havana fishing neighborhood into a work of art. Step inside in 360 degrees.",Inside ‘Fusterlandia’: Cuba's Kaleidoscopic Neighborhood,video,https://www.facebook.com/nytimes/videos/1865872940296886/,2017-05-27 12:55:00,522,68,130,443,68,11,0,0,0,0
5281959998_10151182019659999,"It's one of the earth's most extreme environments. Fly in a helicopter through McMurdo Dry Valleys in Antarctica, where only a handful of people have ever set foot.",Three Six Juliet,video,https://www.facebook.com/nytimes/videos/10151182019659999/,2017-05-27 07:25:00,1819,105,491,1507,140,165,3,1,1,2
5281959998_1865550733662440,"Gunmen opened fire on vehicles taking Coptic Christians to a monastery in Egypt early Friday, killing at least 26 people and wounding 23 others. Read more: http://nyti.ms/2rYMIad",Christians Killed in Egypt Bus Attack,video,https://www.facebook.com/nytimes/videos/1865550733662440/,2017-05-26 16:10:00,2516,168,338,301,2,35,3,1501,674,0
5281959998_1865433253674188,Does the health care bill passed by the House live up to Republicans’ promises? We checked the facts.,Fact Check: The Updated GOP Health Care Bill,video,https://www.facebook.com/nytimes/videos/1865433253674188/,2017-05-26 08:15:38,2010,181,1007,1237,11,35,35,137,555,0
5281959998_1865434503674063,"The Hydrus opened in May, replacing the famous Jet Star roller coaster, which was destroyed by Hurricane Sandy. Experience the ride in this 360° video. Watch more #Daily360: http://nyti.ms/2ru0Jzt",Strap Into the Jersey Shore’s New Roller Coaster,video,https://www.facebook.com/nytimes/videos/1865434503674063/,2017-05-26 08:08:17,509,95,147,444,28,36,0,0,1,0
5281959998_10151183321564999,"Did the Turkish president’s security detail attack protesters in Washington? We reviewed dozens of videos and photos. Here's what they show about 24 men involved.

Read more: http://nyti.ms/2r314bB",,video,https://www.facebook.com/nytimes/videos/10151183321564999/,2017-05-26 00:55:00,12166,1018,9103,3532,32,1658,53,276,6615,0
5281959998_1865183783699135,"In 360, enter a Tulou home in Fujian, China, where multiple families live together in a circular structure. These houses have been designated World Heritage sites. Watch more #Daily360: http://nyti.ms/2ru0Jzt",China’s Ancient Circular Walled Homes,video,https://www.facebook.com/nytimes/videos/1865183783699135/,2017-05-25 17:25:00,2255,142,441,1952,126,171,2,1,2,1
5281959998_10151183043949999,"""We’re befriending death. … We’re taking it back into our own hands.""

Because of Canada’s medical assistance in dying program, John Shields was able to die on his own terms. This is his story: http://nyti.ms/2rVEuQd",Attending His Own Wake,video,https://www.facebook.com/nytimes/videos/10151183043949999/,2017-05-25 17:10:00,38296,2081,30186,26093,8830,416,19,2884,39,15
5281959998_10151182908134999,"Oh Wonder, a London-based duo, is here to perform some songs for us. Comment with your questions, and NYT reporter Andrew R. Chow will ask them some.",Oh Wonder Live Performance,video,https://www.facebook.com/nytimes/videos/10151182908134999/,2017-05-25 13:37:26,2127,622,283,1071,1005,12,9,3,5,22
5281959998_10151182824804999,Help us solve today’s New York Times crossword puzzle. Wordplay columnist Deb Amlen is here with hints. Put your guesses in the comments and please share this with your friends.,The Crossword,video,https://www.facebook.com/nytimes/videos/10151182824804999/,2017-05-25 12:00:30,355,1177,58,288,44,6,8,4,5,0
5281959998_1837335436483970,"We sent a film crew to the Philippines, where death, grief and fear fill the streets. Watch the full documentary: nytimes.com/philippines","When a President Says, ‘I’ll Kill You’",video,https://www.facebook.com/nytimes/videos/1837335436483970/,2017-03-26 10:00:46,3131,522,1139,1205,17,318,23,1305,263,0
5281959998_1837033736514140,"""We couldn't quite get there,"" President Donald J. Trump said about the Republicans' replacement health bill.

Here's a look at why it played out that way.

Watch more: http://nyti.ms/2nUJbe7",Republicans Withdraw Their Health Bill,video,https://www.facebook.com/nytimes/videos/1837033736514140/,2017-03-25 16:45:29,3192,579,389,1857,113,39,1125,9,49,0
5281959998_1836976256519888,"Artist Kendra Haste was commissioned to create sculptures of wild animals that once lived in the Royal Menagerie. Get a 360° view of her studio and the installation at the Tower of London.  

Watch more #Daily360: http://nyti.ms/2nO0M7o",Animals in the Artist's Studio,video,https://www.facebook.com/nytimes/videos/1836976256519888/,2017-03-25 16:10:00,527,19,87,452,35,39,1,0,0,0
5281959998_10151122566324999,"We're at Metro Al Madina in Beirut with the Lebanese band الراحل الكبير The Great Departed, who are playing some songs and talking about their music. Comment with your questions for the band, and NYT journalist Ben Hubbard will ask some.",Live from Beirut: The Great Departed,video,https://www.facebook.com/nytimes/videos/10151122566324999/,2017-03-25 09:25:09,1148,343,188,890,222,12,17,3,4,0
5281959998_10151122134959999,President Trump spoke from the Oval Office after Republicans pulled the House bill that was intended to repeal and replace the Affordable Care Act. http://nyti.ms/2oezqnb,,video,https://www.facebook.com/nytimes/videos/10151122134959999/,2017-03-24 20:55:14,6746,2109,764,1502,35,130,3995,43,1041,0
5281959998_1836565866560927,"Paul Ryan: ""This is a setback, no two ways about it. Obamacare is the law of the land."" 

Republicans decided to pull the bill repealing the Affordable Care Act in a blow to President Donald J. Trump.","Paul Ryan: ""This is a setback, no two ways about it""",video,https://www.facebook.com/nytimes/videos/1836565866560927/,2017-03-24 16:55:00,12266,1481,1209,7338,1076,76,3667,17,92,0
5281959998_10151121767314999,"We're at an outreach site that provides clean needles and Hepatitis C testing to drug users in Chicago. Clif Sanchez manages the site through the Chicago Recovery Alliance. Like many professionals working in the non-profit sector, Clif does not have health insurance through his job and relies on the Affordable Care Act. Comment with your questions and NYT reporter Nilo Tabrizy will ask some.",Chicago health care outreach to drug users,video,https://www.facebook.com/nytimes/videos/10151121767314999/,2017-03-24 12:31:51,601,105,66,518,60,11,3,5,4,0
5281959998_10151121765564999,"Singer-songwriter Raul Midón is here to teach you some of his secrets to playing guitar. Comment with questions about his technique, and NYT reporter Emma Orme NYT will ask some.",Live Performance: Raul Midon,video,https://www.facebook.com/nytimes/videos/10151121765564999/,2017-03-24 12:29:30,1120,290,325,814,253,41,7,1,4,0
5281959998_10151121696039999,"Join us for a conversation from Istanbul about next month's referendum on whether to expand President Recep Tayyip Erdogan’s powers. Patrick Kingsley, an international correspondent for The Times, talked to 2 students about Turkey’s political future and life as a young person in the country today.",,video,https://www.facebook.com/nytimes/videos/10151121696039999/,2017-03-24 11:16:09,470,267,91,415,29,12,2,6,6,0
