status_id,status_message,link_name,status_type,status_link,status_published,num_reactions,num_comments,num_shares,num_likes,num_loves,num_wows,num_hahas,num_sads,num_angrys,num_special
5281959998_10151120953844999,"The music industry in Nashville has a $10 billion annual economic impact on the region. Despite this revenue, 76% of people in Nashville's music industry are uninsured, according to the Music Health Alliance. Mary Gauthier is an American folk-singer and songwriter who was able to get health insurance for the first time through the Affordable Care Act. Comment with your questions, and NYT reporter Nilo Tabrizy will ask some.",Nashville's music industry and the Affordable Care Act,video,https://www.facebook.com/nytimes/videos/10151120953844999/,2017-03-23 18:41:58,878,154,277,672,114,56,4,25,7,0
5281959998_10151120843219999,"We're speaking with Planned Parenthood in Nashville to understand how it might be impacted under the Republican plan to repeal and replace the Affordable Care Act. The current proposal restricts funding to organizations that provide abortion except in cases of incest, rape or when the health of the mother is threatened. NYT reporter Nilo Tabrizy is live with Sarah Rose Peacock and Sandra Amstutz who received health care from Planned Parenthood, and Jeff Teague, President and CEO of Planned Parenthood of Middle and East Tennessee. Comment with your questions, and Nilo will ask some.",Planned Parenthood's Take on the Affordable Care Act,video,https://www.facebook.com/nytimes/videos/10151120843219999/,2017-03-23 16:36:22,978,317,148,760,162,6,3,12,35,0
5281959998_10151120792489999,"A 52-year-old British-born man, Khalid Masood, was behind the attack near British Parliament, police said. Officials say he acted alone, but ISIS has claimed responsibility for the attack.

Read more: http://nyti.ms/2n9VW1p",London Assailant Named After ISIS Claims Attack,video,https://www.facebook.com/nytimes/videos/10151120792489999/,2017-03-23 16:25:00,357,116,56,157,2,3,2,115,78,0
5281959998_10151120546614999,Help us solve The New York Times crossword puzzle using our web game. Wordplay columnist Deb Amlen is here with hints. Put your guesses in the comments and share this with your friends.,The Crossword,video,https://www.facebook.com/nytimes/videos/10151120546614999/,2017-03-23 12:00:29,446,1235,53,378,54,9,3,0,2,0
5281959998_1836008809949966,"An estimated 2.8 million Americans may lose access to treatment for addiction if the Affordable Care Act is repealed. 

Read more: http://nyti.ms/2mUHHM3",Millions Could Lose Addiction Treatment,video,https://www.facebook.com/nytimes/videos/1836008809949966/,2017-03-23 10:56:32,2072,224,512,660,10,40,7,594,761,0
5281959998_1835960656621448,"Come on a 360° family trip but, from a child's perspective. Vacationing kids in China, California, Paris and beyond show you what they really want to see. Watch more #Daily360: http://nyti.ms/2neU493",What a Child Actually Sees On Vacation,video,https://www.facebook.com/nytimes/videos/1835960656621448/,2017-03-23 09:07:45,368,11,65,329,31,7,1,0,0,0
5281959998_10151119750979999,"How should you respond to racially offensive comments in the workplace and in your community? Join NYT reporters John Eligon and Rachel Swarns as they talk with Madeline Vann, a reader from Virginia who reached out to them in search of a strategy. Leave your thoughts and questions in the comments, and subscribe to our Race/Related newsletter here: http://nyti.ms/1Naa9FX",#RaceNYT: Confronting Racially Offensive Comments,video,https://www.facebook.com/nytimes/videos/10151119750979999/,2017-03-22 20:18:58,470,198,98,398,51,12,3,3,3,0
5281959998_10151119618769999,"Grammy Award-winning guitarist, vocalist and songwriter Gary Clark Jr is at The New York Times - TimesTalks. Hear about his creative process and preview some tracks from his upcoming album. Questions or comments? Leave them below.","TimesTalks: Gary Clark, Jr.",video,https://www.facebook.com/nytimes/videos/10151119618769999/,2017-03-22 18:08:57,1504,371,329,1137,337,14,9,3,4,0
5281959998_1835678966649617,"How the attack at Britain's Parliament unfolded on Wednesday. 

Read more: http://nyti.ms/2nKqVo1",What Happened: Attack in London,video,https://www.facebook.com/nytimes/videos/1835678966649617/,2017-03-22 16:55:00,2046,118,425,652,6,154,5,1161,68,0
5281959998_10151119486644999,"We're in Kentucky talking to people about the proposed plan to repeal and replace the Affordable Care Act. Join NYT reporter Nilo Tabrizy and Dustin Pugel from the Kentucky Center for Economic Policy as they discuss how the state's significant gains from the ACA make its newly-insured population vulnerable to rollbacks in health insurance coverage. Leave your questions in the comments, and Nilo will ask some.",Health Care in Kentucky,video,https://www.facebook.com/nytimes/videos/10151119486644999/,2017-03-22 16:01:13,512,361,109,394,34,6,2,52,24,0
5281959998_10151119334934999,"We're by the British Parliament, near the site of an attack that left at least 3 people dead and 20 others injured, according to officials. New York Times journalists Camilla Schick, Stephen Farrell and Prashant Rao are at the scene to break down the details. Comment with your questions, and they will respond to some.",Update on U.K. Parliament Attack,video,https://www.facebook.com/nytimes/videos/10151119334934999/,2017-03-22 13:53:42,1349,372,247,502,41,27,3,658,118,0
5281959998_1835605893323591,Judge Neil Gorsuch — President Donald J. Trump’s pick for Supreme Court justice — is a constitutional originalist. What does that mean?,Gorsuch is an Originalist. What's That?,video,https://www.facebook.com/nytimes/videos/1835605893323591/,2017-03-22 13:10:00,745,327,198,415,14,14,18,50,234,0
5281959998_10151119217964999,"We're at Big Ben in London, where a police officer was stabbed outside the House of Parliament. The assailant was shot by officers, and the Metropolitan Police said it was treating the violence as a ""terrorist incident."" NYT reporter Stephen Farrell is at the scene to bring you live updates. Comment with your questions, and he'll respond to some.",Assailant shot at U.K. Parliament,video,https://www.facebook.com/nytimes/videos/10151119217964999/,2017-03-22 12:01:01,994,423,218,401,35,51,5,390,112,0
5281959998_1835577516659762,"Watch as hundreds of people line up for free medical services like checkups, dental treatments and eye care at a pop-up health care clinic in Cookeville, Tennessee. #Daily360","""They're Literally Saving My Life""",video,https://www.facebook.com/nytimes/videos/1835577516659762/,2017-03-22 11:40:00,6896,792,2046,4536,161,836,33,1282,48,0
5281959998_1835583169992530,"British Parliament was placed on lockdown after a man stabbed a police officer and was then shot by other officers. The Metropolitan Police said it was treating the violence as ""a terrorist incident,"" as the country’s seat of power was put on high alert. 

Read more: http://nyti.ms/2ndxy0u",U.K. Parliament Attacker Shot,video,https://www.facebook.com/nytimes/videos/1835583169992530/,2017-03-22 11:33:15,694,96,110,265,4,60,1,342,22,0
5281959998_10151119183839999,"We're visiting the Kenton County Detention Center's substance abuse treatment program in Covington, Kentucky. What is it like to receive treatment while in jail? Hear from people who will soon be released into the community. Comment with your questions, and NYT reporter Nilo Tabrizy will ask some of her own.",Substance Treatment Abuse Discussion,video,https://www.facebook.com/nytimes/videos/10151119183839999/,2017-03-22 11:22:48,457,200,221,389,51,3,0,13,1,0
5281959998_1835537649997082,"Hundreds of people lined up for free health care at a pop-up clinic in Cookeville, Tennessee. Watch more #Daily360: http://nyti.ms/2nkLNBc","""They're Literally Saving My Life""",video,https://www.facebook.com/nytimes/videos/1835537649997082/,2017-03-22 09:40:00,3117,444,873,1973,78,351,14,671,30,0
5281959998_10151118628784999,"Real Estate, an American rock band, is here to perform some songs for us. Follow along in the comments for insights from NYT reporters Joe Coscarelli and Caryn Ganz.",Live Music: Real Estate,video,https://www.facebook.com/nytimes/videos/10151118628784999/,2017-03-21 19:24:49,569,89,42,479,82,3,2,0,3,0
5281959998_10151118519964999,"Real Estate, a rock band, is at The New York Times doing a soundcheck before they perform live. You can watch their performance and ask them questions here: https://nyti.ms/2mMj1W6",Live Performance: Real Estate,video,https://www.facebook.com/nytimes/videos/10151118519964999/,2017-03-21 18:04:44,608,132,54,497,101,3,4,2,1,0
5281959998_10151118443184999,"Join us for a tour of the French ambassador's residence in Washington, and a glimpse into chef Michel Bastid's preparations for the residence's ""Goût de France"" event tonight. Comment with your questions, and Gardiner Harris, who covers the State Department for The Times, will ask some.",Tour of French ambassador's residence in Washington,video,https://www.facebook.com/nytimes/videos/10151118443184999/,2017-03-21 15:38:21,614,202,89,521,74,11,7,0,1,0
5281959998_10151118220389999,"The confirmation hearings for Supreme Court  Neil Gorsuch continue today. NYT's chief Washington correspondent Carl Hulse is with NYT's congressional reporter Matt Flegenheimer to break it all down for us. Ask them questions, and they'll answer some.",Gorsuch confirmation hearing: Day 2,video,https://www.facebook.com/nytimes/videos/10151118220389999/,2017-03-21 11:25:38,414,200,53,323,23,5,6,4,53,0
5281959998_10151118147764999,"We're at Artcurial, an auction house in Paris with “Andromede,” a masterpiece by sculptor Auguste Rodin that will be auctioned here in May. Andromede hasn’t been seen in public for 130 years and has an extraordinary story. Artcurial's Vice-President Fabien Naudan is with us to explain its cultural significance. Leave your questions in the comments, and NYT reporter Daphné Anglès will ask him some.",Rodin Masterpiece on Display,video,https://www.facebook.com/nytimes/videos/10151118147764999/,2017-03-21 10:18:21,760,176,149,565,142,47,1,1,4,0
5281959998_1835122173371963,See The New York Times roll off the presses in this 360° video tour of our largest printing facility. #Daily360,Speed Through a Newspaper Printing Press,video,https://www.facebook.com/nytimes/videos/1835122173371963/,2017-03-21 10:10:00,1952,114,460,1704,128,98,6,6,10,0
5281959998_10151118106674999,"Meet a 22-year-old scientist who is inspiring young girls to get excited about science, technology, engineering and math. Olivia Pavco-Giaccia, founder of LabCandy, will conduct an experiment and then give advice for young women. Join us and leave questions in the comments section, and NYT reporter Madison Mills NYT will ask some.",Women In Science,video,https://www.facebook.com/nytimes/videos/10151118106674999/,2017-03-21 09:33:28,3062,479,572,2535,467,32,15,6,7,0
5281959998_1835111473373033,See The New York Times roll off the presses in this 360° video tour of the paper's largest printing facility. Watch more #Daily360: http://nyti.ms/2nLL75q,Speed Through a Newspaper Printing Press,video,https://www.facebook.com/nytimes/videos/1835111473373033/,2017-03-21 09:10:00,523,29,82,478,28,16,1,0,0,0
5281959998_10151118054104999,"March marks the 2-year anniversary of the conflict in Yemen, which has left almost 19 million people in need of humanitarian assistance and displaced millions. Shabia Mantoo, a spokesperson for UNHCR, the UN Refugee Agency, is taking your questions live about this largely forgotten crisis.",Refugees in Yemen,video,https://www.facebook.com/nytimes/videos/10151118054104999/,2017-03-21 08:34:19,1320,307,488,874,96,6,7,325,12,0
5281959998_10151117237819999,"As massive skyscrapers rise up in Shanghai, some residents are resisting the demolition of their homes. The construction continues around them. #Daily360",Shanghai Holdout Defies a High-Rise Boom,video,https://www.facebook.com/nytimes/videos/10151117237819999/,2017-03-20 15:40:00,586,48,103,450,12,36,3,77,8,0
5281959998_1834830070067840,"The FBI chief, James Comey, announced that the FBI is investigating whether there was any coordination between Donald J. Trump's campaign and Russia during the 2016 election.

Here's the full story: http://nyti.ms/2nL3o31",F.B.I. Director Confirms Russia Investigation,video,https://www.facebook.com/nytimes/videos/1834830070067840/,2017-03-20 14:10:04,11939,979,3002,10404,788,228,161,19,339,0
5281959998_10151117379874999,"We're in West Virginia talking to people about how the proposed plan to repeal and replace the Affordable Care Act could affect them. NYT reporter Nilo Tabrizy is with Bailey Hendricks, who is receiving Suboxone treatment for heroin addictions. They're at Bailey's local clinic in Charleston, West Virginia to talk about how having health insurance has impacted her life. Put your questions in the comments, and Nilo will ask some.",Treatment for Heroin Addiction in West Virginia,video,https://www.facebook.com/nytimes/videos/10151117379874999/,2017-03-20 12:38:32,935,431,159,732,138,9,7,33,16,0
5281959998_10151116502654999,"Fearing deportation, Jeanette Vizguerra has been living in a church basement for the last month. Watch as her children and grandchildren visit her in sanctuary. #Daily360

Read more: http://nyti.ms/2mJtC4N",A Mother Goes Into Hiding,video,https://www.facebook.com/nytimes/videos/10151116502654999/,2017-03-19 13:25:00,889,108,139,419,15,11,5,385,54,0
5281959998_1834344586783055,"How did Jimmy Breslin's coverage of President John F. Kennedy’s funeral change journalism?

Read and watch more: http://nyti.ms/2noxPhY","Jimmy Breslin, Legendary New York City Newspaper Columnist, Di...",video,https://www.facebook.com/nytimes/videos/1834344586783055/,2017-03-19 12:10:00,3024,60,774,2682,233,65,1,43,0,0
5281959998_10151114701674999,"Chicken shawarma, no food cart or rotisserie required.

Get the full recipe: http://nyti.ms/1dlVWVe",,video,https://www.facebook.com/nytimes/videos/10151114701674999/,2017-03-19 07:55:00,12260,1652,10056,11161,926,156,9,6,2,0
5281959998_10151115987514999,Remembering rock 'n' roll legend Chuck Berry. Read more: http://nyti.ms/2n9AnA4,Rock Legend Chuck Berry Dies at 90,video,https://www.facebook.com/nytimes/videos/10151115987514999/,2017-03-18 18:30:00,1253,46,733,919,125,3,0,206,0,0
5281959998_10151114744744999,"Year after year, militarized SWAT teams storm houses in raids for drugs. The errors prove disastrous.

Door-busting drug raids have led to avoidable deaths, gruesome injuries and costly settlements, a Times investigation found. Read more: http://nyti.ms/2nQ89rf",Door-Busting Drug Raids Leave a Trail of Blood,video,https://www.facebook.com/nytimes/videos/10151114744744999/,2017-03-18 17:25:00,2340,193,801,1245,8,99,3,320,665,0
5281959998_10151115629424999,"A furniture maker in Phoenix is accusing Alibaba, China's largest e-commerce company, of tolerating sales of counterfeits. Step inside his workshop to see what’s at stake for the originals. #Daily360",Fighting Fakes on Alibaba From Arizona,video,https://www.facebook.com/nytimes/videos/10151115629424999/,2017-03-18 16:27:23,413,63,78,326,6,28,2,9,42,0
5281959998_10151115671474999,"Take a walk through the Horror Hound convention for horror fans in Cincinnati. NYT senior culture editor Erik Piepenburg will be your guide. Leave your questions for him, and he will answer some.",Horror Hound Convention,video,https://www.facebook.com/nytimes/videos/10151115671474999/,2017-03-18 11:08:30,882,258,202,728,99,20,23,2,10,0
5281959998_10151113739379999,"In 2011, war broke out in the Nuba Mountains of Sudan. Thousands have been forced to flee.

In our latest virtual reality film, meet 4 people struggling to improve their lives there.",We Who Remain,video,https://www.facebook.com/nytimes/videos/10151113739379999/,2017-03-18 09:40:00,471,27,114,326,16,4,2,120,3,0
5281959998_10151115279344999,"A look at the reactions, clarifications and explanations after President Donald J. Trump accused Barack Obama of tapping his phones last fall.",A Timeline on Trump’s Wiretap Claims,video,https://www.facebook.com/nytimes/videos/10151115279344999/,2017-03-18 08:55:00,11129,1146,3820,6257,69,405,2007,190,2201,0
5281959998_1833463126871201,"The musical ""Miss Saigon"" — a love story set during the Vietnam War — ignited a debate about yellowface and casting. Now, it's back on Broadway. Read the full story: http://nyti.ms/2mQtamc",The Battle of ‘Miss Saigon’,video,https://www.facebook.com/nytimes/videos/1833463126871201/,2017-03-17 17:10:00,15965,815,4945,13420,2195,331,8,2,8,1
5281959998_10151114648194999,"When the tide goes out, these ice caves in northern Quebec open with an abundance of mussels. Then, the local Inuit have an hour to harvest them before the tide floods back in. #Daily360

More stunning photos here: http://nyti.ms/2nN3F4w",A Harvest Underneath the Ice,video,https://www.facebook.com/nytimes/videos/10151114648194999/,2017-03-17 15:55:01,4164,146,874,3291,195,662,12,2,2,0
5281959998_10151114879114999,"Before Amy Krouse Rosenthal got the terminal cancer diagnosis that inspired her heartbreaking, now viral Modern Love piece, ""You May Want to Marry My Husband,"" she was a revered creator of children's books. NY Times Book Review editor Pamela Paul will read from and talk about Amy's most popular picture books. Illustrator Tom Lichtenheld, Amy's close friend and collaborator, will join us to draw and talk about their work together.",Amy Krouse Rosenthal's Books,video,https://www.facebook.com/nytimes/videos/10151114879114999/,2017-03-17 14:03:06,1069,130,196,733,233,5,6,90,2,0
5281959998_10151114731099999,"What is the future of identity? How will we identify ourselves in 2117? Post your ideas in the comments, and artist Franziska Barczyk will put some of them in her collage of portraits from the future.",Portraits From the Future,video,https://www.facebook.com/nytimes/videos/10151114731099999/,2017-03-17 11:02:39,539,222,101,473,44,14,2,1,5,0
5281959998_1833182523565928,"Kim Han-sol, the nephew of North Korean ruler Kim Jong-un, is young, college-educated, fluent in English and living abroad. And he has called his uncle a dictator. But chances are slim he could ever lead his homeland. Here's why.",A Future Leader of North Korea?,video,https://www.facebook.com/nytimes/videos/1833182523565928/,2017-03-17 06:10:00,3126,269,720,2674,26,260,7,149,10,0
5281959998_10151114402614999,"Join us for a performance by the Indigenous Intrudaz, a rap group based in the Brisbane, Australia suburb of Inala. We will discuss what inspires their music and the issues that Indigenous people face in Australia. Leave your questions and comments, and NYT reporter John Eligon will ask some. He's currently reporting on race in Australia in conjunction with the Australian Broadcasting Corporation.",,video,https://www.facebook.com/nytimes/videos/10151114402614999/,2017-03-17 01:38:15,1036,367,269,844,159,22,8,3,0,0
5281959998_10151113744634999,The desert is blooming in California. See the rare super bloom up close in 360°. #Daily360,The Desert is Blooming,video,https://www.facebook.com/nytimes/videos/10151113744634999/,2017-03-16 16:55:00,3855,213,735,3306,400,137,5,3,4,0
5281959998_10151113916044999,"In late November, President Donald J. Trump worked with United Technology Corporation to keep about 800 jobs at its Carrier plant from moving to Mexico. But roughly 700 positions at a sister plant were still relocated. We're live with some of the Huntington, Indiana factory workers whose jobs weren't saved. Post your questions for them in the comments, and NYT economics reporter Nelson Schwartz will ask them.",Live With United Technology Corporation Workers In Indiana,video,https://www.facebook.com/nytimes/videos/10151113916044999/,2017-03-16 15:24:43,1312,949,394,667,34,45,54,273,239,0
5281959998_10151113721964999,"A woman managed to pull herself from debris and mud on the outskirts of Lima, after heavy rains triggered floods across Peru.","In Peru, Woman Narrowly Escape Mudslide",video,https://www.facebook.com/nytimes/videos/10151113721964999/,2017-03-16 12:40:04,6369,529,4150,1851,37,1673,8,2780,20,0
5281959998_10151113720744999,"In 2005, President Donald J. Trump paid $38 million in federal income taxes on a reported income of $150 million. The journalist David Cay Johnston joins us now to talk about how he obtained Trump's 2005 tax return. Comment with your questions for him, and NYT reporter Madison Mills NYT will ask him some.",Interview with David Cay Johnston,video,https://www.facebook.com/nytimes/videos/10151113720744999/,2017-03-16 11:51:47,2237,1289,437,1635,200,39,25,20,318,0
5281959998_1832939283590252,"“Come with me, your wife is here.” This moment seemed impossible to Mohammed Alqalos just 6 weeks ago.","Caught Up in Travel Ban, a Family Reunites",video,https://www.facebook.com/nytimes/videos/1832939283590252/,2017-03-16 11:40:01,3227,61,120,2386,823,11,3,3,1,0
5281959998_10151112893644999,"Come and paint with us. Matthew Adam Ross is an abstract artist who makes what he calls modern cave paintings. Tell us what colors and designs you want to see in the comments, and NYT reporter Nilo Tabrizy will ask Matthew to paint some of them.",Live Abstract Painting,video,https://www.facebook.com/nytimes/videos/10151112893644999/,2017-03-15 15:26:27,523,485,76,417,55,6,35,4,6,0
5281959998_10151112760489999,The Fed raised interest rates today for the third time since the financial crisis. NYT reporter Nelson Schwartz explains what that means for you and your wallet. Leave your questions in the comments and he'll try to answer some.,Fed Raises Interest Rates,video,https://www.facebook.com/nytimes/videos/10151112760489999/,2017-03-15 13:23:37,755,197,231,668,28,38,2,2,17,0
5281959998_10151112488779999,"Pieces of a 3,000-year-old statue are being excavated from a residential neighborhood in Cairo. Archaeologists believe the statue could be of Pharaoh Ramses II, one of ancient Egypt’s most famous rulers. #Daily360",Raising a Possible Pharaoh in Cairo,video,https://www.facebook.com/nytimes/videos/10151112488779999/,2017-03-15 11:25:00,7215,286,1533,5812,425,941,22,5,10,0
5281959998_10151112572464999,"We're at MNDFL for a sound bath meditation session where crystal, Himalayan singing bowls, and tuning forks help ease the mind. This is part of a new self-care series called ""Me Time."" Comment with your questions below and NYT reporter Marisa Meltzer will answer some.",Live Sound Bath Meditation,video,https://www.facebook.com/nytimes/videos/10151112572464999/,2017-03-15 10:17:31,1158,376,232,878,206,16,42,7,9,0
5281959998_10151112517584999,"NYT Cairo bureau chief Declan Walsh talks to a group of fellow journalists in Cairo about press freedom, specifically the difficulties of working in public spaces in Egypt. We'll be addressing your questions in the comments.",Press Freedom in Cairo,video,https://www.facebook.com/nytimes/videos/10151112517584999/,2017-03-15 09:56:00,861,232,131,780,55,18,1,3,4,0
5281959998_1832378666979647,"President Donald J. Trump wrote off more than $100 million in business losses to reduce his federal taxes in 2005, according to forms made public on The Rachel Maddow Show. Read more: http://nyti.ms/2nEFmWt",Trump Tax Document Disclosed,video,https://www.facebook.com/nytimes/videos/1832378666979647/,2017-03-15 09:15:42,2420,1061,506,1263,18,214,150,25,750,0
5281959998_1832260833658097,"Jordan Peele became the first black filmmaker with a $100 million movie debut. But his British lead actor, Daniel Kaluuya, has had to defend his casting after it was challenged by Samuel L. Jackson.",‘Get Out’ Makes Hollywood History,video,https://www.facebook.com/nytimes/videos/1832260833658097/,2017-03-15 07:12:01,5671,231,245,5273,342,47,5,1,3,0
5281959998_1832249370325910,"Geert Wilders, a far-right Dutch politician, has compared the Quran to ""Mein Kampf"" and has called Moroccans ""scum."" Read on: http://nyti.ms/2mK3glT","Geert Wilders, a Rising Anti-Muslim Voice",video,https://www.facebook.com/nytimes/videos/1832249370325910/,2017-03-15 03:55:01,2958,799,610,1022,56,77,39,276,1488,0
5281959998_10151111454069999,"Stroll through Theaster Gates's exhibit at the National Gallery of Art where he salvages architectural elements from the past, like a church roof and a gym floor, and turns them into art.  #Daily360",Theaster Gates and the Art of Community,video,https://www.facebook.com/nytimes/videos/10151111454069999/,2017-03-14 16:10:00,427,22,69,386,29,11,1,0,0,0
5281959998_10151111802744999,"We're touring the Hollywood set where the ABC comedy, American Housewife, is taped and talking to the show's star, Katy Mixon, and creator, Sarah Dunn. Leave your questions in the comments, and NYT reporter Brooks Barnes will ask some live.",American Housewife Set Tour,video,https://www.facebook.com/nytimes/videos/10151111802744999/,2017-03-14 15:51:10,1085,461,76,680,363,6,29,2,5,0
5281959998_10151111679369999,"We're in Albany, where a storm has left the city covered in snow. Join us for a walk through the cold. Comment with questions, and NYT reporter Jesse McKinley will answer some.",Snow in Albany,video,https://www.facebook.com/nytimes/videos/10151111679369999/,2017-03-14 13:32:02,2461,442,410,1852,116,445,24,16,8,0
5281959998_10151111627844999,"Find out how to win your March Madness bracket pool by joining NYT sports reporter Marc Tracy, as he fills out his NCAA tournament bracket. Comment with your questions about his predictions, and he'll respond to some.",March Madness bracketology,video,https://www.facebook.com/nytimes/videos/10151111627844999/,2017-03-14 12:22:09,306,96,34,283,16,1,0,4,2,0
